{
  "schema_version": "0.2",
  "engine": "postgres",
  "database": "datalchemy_crm",
  "schemas": [
    {
      "name": "crm",
      "tables": [
        {
          "name": "anotacoes",
          "kind": "table",
          "comment": null,
          "columns": [
            {
              "ordinal_position": 1,
              "name": "id",
              "column_type": {
                "data_type": "uuid",
                "udt_schema": "pg_catalog",
                "udt_name": "uuid",
                "character_max_length": null,
                "numeric_precision": null,
                "numeric_scale": null,
                "collation": null
              },
              "is_nullable": false,
              "default": "gen_random_uuid()",
              "identity": null,
              "generated": null,
              "comment": null
            },
            {
              "ordinal_position": 2,
              "name": "atividade_id",
              "column_type": {
                "data_type": "uuid",
                "udt_schema": "pg_catalog",
                "udt_name": "uuid",
                "character_max_length": null,
                "numeric_precision": null,
                "numeric_scale": null,
                "collation": null
              },
              "is_nullable": false,
              "default": null,
              "identity": null,
              "generated": null,
              "comment": null
            },
            {
              "ordinal_position": 3,
              "name": "conteudo",
              "column_type": {
                "data_type": "text",
                "udt_schema": "pg_catalog",
                "udt_name": "text",
                "character_max_length": null,
                "numeric_precision": null,
                "numeric_scale": null,
                "collation": null
              },
              "is_nullable": false,
              "default": null,
              "identity": null,
              "generated": null,
              "comment": null
            },
            {
              "ordinal_position": 4,
              "name": "criado_em",
              "column_type": {
                "data_type": "timestamp with time zone",
                "udt_schema": "pg_catalog",
                "udt_name": "timestamptz",
                "character_max_length": null,
                "numeric_precision": null,
                "numeric_scale": null,
                "collation": null
              },
              "is_nullable": false,
              "default": "now()",
              "identity": null,
              "generated": null,
              "comment": null
            }
          ],
          "constraints": [
            {
              "kind": "primary_key",
              "name": "anotacoes_pkey",
              "columns": [
                "id"
              ]
            },
            {
              "kind": "unique",
              "name": "anotacoes_atividade_unique",
              "columns": [
                "atividade_id"
              ],
              "is_deferrable": false,
              "initially_deferred": false
            },
            {
              "kind": "foreign_key",
              "name": "anotacoes_atividade_id_fkey",
              "columns": [
                "atividade_id"
              ],
              "referenced_schema": "crm",
              "referenced_table": "atividades",
              "referenced_columns": [
                "id"
              ],
              "on_update": "no_action",
              "on_delete": "cascade",
              "match_type": "simple",
              "is_deferrable": false,
              "initially_deferred": false
            }
          ],
          "indexes": [
            {
              "name": "anotacoes_atividade_unique",
              "is_unique": true,
              "is_primary": false,
              "is_valid": true,
              "method": "btree",
              "definition": "CREATE UNIQUE INDEX anotacoes_atividade_unique ON crm.anotacoes USING btree (atividade_id)"
            },
            {
              "name": "anotacoes_pkey",
              "is_unique": true,
              "is_primary": true,
              "is_valid": true,
              "method": "btree",
              "definition": "CREATE UNIQUE INDEX anotacoes_pkey ON crm.anotacoes USING btree (id)"
            }
          ]
        },
        {
          "name": "atividades",
          "kind": "table",
          "comment": null,
          "columns": [
            {
              "ordinal_position": 1,
              "name": "id",
              "column_type": {
                "data_type": "uuid",
                "udt_schema": "pg_catalog",
                "udt_name": "uuid",
                "character_max_length": null,
                "numeric_precision": null,
                "numeric_scale": null,
                "collation": null
              },
              "is_nullable": false,
              "default": "gen_random_uuid()",
              "identity": null,
              "generated": null,
              "comment": null
            },
            {
              "ordinal_position": 2,
              "name": "usuario_id",
              "column_type": {
                "data_type": "uuid",
                "udt_schema": "pg_catalog",
                "udt_name": "uuid",
                "character_max_length": null,
                "numeric_precision": null,
                "numeric_scale": null,
                "collation": null
              },
              "is_nullable": false,
              "default": null,
              "identity": null,
              "generated": null,
              "comment": null
            },
            {
              "ordinal_position": 3,
              "name": "contato_id",
              "column_type": {
                "data_type": "uuid",
                "udt_schema": "pg_catalog",
                "udt_name": "uuid",
                "character_max_length": null,
                "numeric_precision": null,
                "numeric_scale": null,
                "collation": null
              },
              "is_nullable": true,
              "default": null,
              "identity": null,
              "generated": null,
              "comment": null
            },
            {
              "ordinal_position": 4,
              "name": "oportunidade_id",
              "column_type": {
                "data_type": "uuid",
                "udt_schema": "pg_catalog",
                "udt_name": "uuid",
                "character_max_length": null,
                "numeric_precision": null,
                "numeric_scale": null,
                "collation": null
              },
              "is_nullable": true,
              "default": null,
              "identity": null,
              "generated": null,
              "comment": null
            },
            {
              "ordinal_position": 5,
              "name": "tipo",
              "column_type": {
                "data_type": "text",
                "udt_schema": "pg_catalog",
                "udt_name": "text",
                "character_max_length": null,
                "numeric_precision": null,
                "numeric_scale": null,
                "collation": null
              },
              "is_nullable": false,
              "default": null,
              "identity": null,
              "generated": null,
              "comment": null
            },
            {
              "ordinal_position": 6,
              "name": "status",
              "column_type": {
                "data_type": "crm.status_atividade",
                "udt_schema": "crm",
                "udt_name": "status_atividade",
                "character_max_length": null,
                "numeric_precision": null,
                "numeric_scale": null,
                "collation": null
              },
              "is_nullable": false,
              "default": "'pendente'::crm.status_atividade",
              "identity": null,
              "generated": null,
              "comment": null
            },
            {
              "ordinal_position": 7,
              "name": "assunto",
              "column_type": {
                "data_type": "text",
                "udt_schema": "pg_catalog",
                "udt_name": "text",
                "character_max_length": null,
                "numeric_precision": null,
                "numeric_scale": null,
                "collation": null
              },
              "is_nullable": false,
              "default": null,
              "identity": null,
              "generated": null,
              "comment": null
            },
            {
              "ordinal_position": 8,
              "name": "descricao",
              "column_type": {
                "data_type": "text",
                "udt_schema": "pg_catalog",
                "udt_name": "text",
                "character_max_length": null,
                "numeric_precision": null,
                "numeric_scale": null,
                "collation": null
              },
              "is_nullable": true,
              "default": null,
              "identity": null,
              "generated": null,
              "comment": null
            },
            {
              "ordinal_position": 9,
              "name": "data_inicio",
              "column_type": {
                "data_type": "timestamp with time zone",
                "udt_schema": "pg_catalog",
                "udt_name": "timestamptz",
                "character_max_length": null,
                "numeric_precision": null,
                "numeric_scale": null,
                "collation": null
              },
              "is_nullable": false,
              "default": null,
              "identity": null,
              "generated": null,
              "comment": null
            },
            {
              "ordinal_position": 10,
              "name": "data_fim",